{
  "context_version": "1.0.0",
  "fixture": true,
  "hardware_profile": "fixture-profile",
  "hardware_revision": "rev-a",
  "installed_firmware_id": "fixture-v1",
  "limits": {
    "container_bytes": 1048576,
    "inventory_files": 100
  },
  "namespaces": [
    {
      "case_semantics": "sensitive",
      "firmware_id": "fixture-v1",
      "forbid_trailing_dot_space": false,
      "forbidden_characters": "",
      "hierarchical": true,
      "max_component_bytes": 255,
      "max_file_bytes": 1048576,
      "max_path_bytes": 490,
      "namespace_id": "7",
      "operations": [
        "stat",
        "get",
        "mkdir",
        "create",
        "replace"
      ],
      "writable": true,
      "write_budget_bytes": 1048576
    },
    {
      "case_semantics": "sensitive",
      "firmware_id": "fixture-v2",
      "forbid_trailing_dot_space": false,
      "forbidden_characters": "",
      "hierarchical": true,
      "max_component_bytes": 255,
      "max_file_bytes": 1048576,
      "max_path_bytes": 490,
      "namespace_id": "7",
      "operations": [
        "stat",
        "get",
        "mkdir",
        "create",
        "replace"
      ],
      "writable": true,
      "write_budget_bytes": 1048576
    }
  ],
  "product_id": "fixture-board",
  "supported_methods": [
    "fixture-flash-method"
  ],
  "trusted_binding_sha256": [
    "f02c634d120c633f8bd12bdb57ea16f2e9ab4cb1905f8b3ed0887f0bbed9a3d4",
    "c331272b36ee9d789a97f6b9b3fea417c96f0b13a51834ecac6663816b5a86ae"
  ],
  "trusted_consumer_sha256": [
    "eb73c779c70cba4806da1a8179ad5758b1040ba5bb9ce184b97a84aac5fe7ebd"
  ],
  "trusted_container_sha256": "d9f017e9244b97fa6f53f3e92d73b78f0e1f292ef17743edaa3d131d0f564186",
  "trusted_install_sha256": "9f2b2322199d6769004a23c92889cc7838df448644a3ed8e1744ad6f0426a4ee",
  "trusted_manifest_sha256": "a31e9b905db533cb16bfea7c6e0ca0b26056fc23e3478514e10f0c8b5af23f8b"
}
