{
  "context_version": "1.0.0",
  "fixture": true,
  "hardware_profile": "fixture-profile",
  "hardware_revision": "rev-a",
  "installed_firmware_id": null,
  "limits": {
    "container_bytes": 1048576,
    "inventory_files": 100
  },
  "namespaces": [
    {
      "case_semantics": "sensitive",
      "firmware_id": "fixture-v2",
      "forbid_trailing_dot_space": false,
      "forbidden_characters": "",
      "hierarchical": false,
      "max_component_bytes": 255,
      "max_file_bytes": 1048576,
      "max_path_bytes": 490,
      "namespace_id": "7",
      "operations": [
        "stat",
        "get",
        "create"
      ],
      "writable": true,
      "write_budget_bytes": 1048576
    }
  ],
  "product_id": "fixture-board",
  "supported_methods": [
    "fixture-flash-method"
  ],
  "trusted_binding_sha256": [
    "c331272b36ee9d789a97f6b9b3fea417c96f0b13a51834ecac6663816b5a86ae"
  ],
  "trusted_consumer_sha256": [
    "eb73c779c70cba4806da1a8179ad5758b1040ba5bb9ce184b97a84aac5fe7ebd"
  ],
  "trusted_container_sha256": "961d93a90f508a86dcefeb07a812db21a46231a1b3e48eb9f4c996650961d6fa",
  "trusted_install_sha256": "9f2b2322199d6769004a23c92889cc7838df448644a3ed8e1744ad6f0426a4ee",
  "trusted_manifest_sha256": "38fdf2bb1ddb18d777d65fa00e496918221c7490fa2929310ccf18d99fbd6547"
}
